<?xml version="1.0" encoding="UTF-8"?>
<list xmlns:xsi="http://www.w3.org/2001/XMLSchema-instance" xsi:noNamespaceSchemaLocation="../../../../xsd/skillTrees.xsd">
	<skillTree type="classSkillTree" classId="107" parentClassId="34">
		<skill skillName="Arrest" skillId="402" skillLevel="11" getLevel="76" levelUpSp="7600000" />
		<skill skillName="Divine Inspiration" skillId="1405" skillLevel="3" getLevel="76" levelUpSp="7600000">
			<item id="8620" count="1" /> <!-- Ancient Book: Divine Inspiration (Manuscript) -->
		</skill>
		<skill skillName="Divine Inspiration" skillId="1405" skillLevel="4" getLevel="76" levelUpSp="7600000">
			<item id="8621" count="1" /> <!-- Ancient Book: Divine Inspiration (Original Version) -->
		</skill>
		<skill skillName="Dual Weapon Mastery" skillId="144" skillLevel="38" getLevel="76" levelUpSp="7600000" />
		<skill skillName="Heavy Armor Mastery" skillId="232" skillLevel="53" getLevel="76" levelUpSp="7600000" />
		<skill skillName="Sting" skillId="223" skillLevel="50" getLevel="76" levelUpSp="7600000" />
		<skill skillName="Freezing Strike" skillId="105" skillLevel="25" getLevel="76" levelUpSp="7600000" />
		<skill skillName="Drain HP" skillId="70" skillLevel="54" getLevel="76" levelUpSp="7600000" />
		<skill skillName="Magic Resistance" skillId="147" skillLevel="52" getLevel="76" levelUpSp="7600000" />
		<skill skillName="Mount Saber Tooth Cougar" skillId="1835" skillLevel="1" getLevel="76">
			<item id="90040" count="1" /> <!-- Spellbook: Mount Saber Tooth Cougar -->
		</skill>
		<skill skillName="Hex" skillId="122" skillLevel="16" getLevel="76" levelUpSp="7600000" />
		<skill skillName="Deadly Strike" skillId="1632" skillLevel="1" getLevel="76" levelUpSp="7600000" />
		<skill skillName="Power Break" skillId="115" skillLevel="18" getLevel="76" levelUpSp="7600000" />
		
		<skill skillName="Dual Weapon Mastery" skillId="144" skillLevel="39" getLevel="77" levelUpSp="7600000" />
		<skill skillName="Heavy Armor Mastery" skillId="232" skillLevel="54" getLevel="77" levelUpSp="7600000" />
		<skill skillName="Sting" skillId="223" skillLevel="51" getLevel="77" levelUpSp="7600000" />
		<skill skillName="Drain HP" skillId="70" skillLevel="55" getLevel="77" levelUpSp="7600000" />
		<skill skillName="Magic Resistance" skillId="147" skillLevel="53" getLevel="77" levelUpSp="7600000" />
		<skill skillName="Deadly Strike" skillId="1632" skillLevel="2" getLevel="77" levelUpSp="7600000" />
		<skill skillName="Dance of Shadows" skillId="366" skillLevel="1" getLevel="77" levelUpSp="7600000">
			<item id="90094" count="1" /> <!-- Scroll: Dance of Shadows -->
		</skill>
		
		<skill skillName="Arrest" skillId="402" skillLevel="12" getLevel="78" levelUpSp="17800000" />
		<skill skillName="Dual Weapon Mastery" skillId="144" skillLevel="40" getLevel="78" levelUpSp="17800000" />
		<skill skillName="Heavy Armor Mastery" skillId="232" skillLevel="55" getLevel="78" levelUpSp="17800000" />
		<skill skillName="Sting" skillId="223" skillLevel="52" getLevel="78" levelUpSp="17800000" />
		<skill skillName="Freezing Strike" skillId="105" skillLevel="26" getLevel="78" levelUpSp="17800000" />
		<skill skillName="Drain HP" skillId="70" skillLevel="56" getLevel="78" levelUpSp="17800000" />
		<skill skillName="Magic Resistance" skillId="147" skillLevel="54" getLevel="78" levelUpSp="17800000" />
		<skill skillName="Hex" skillId="122" skillLevel="17" getLevel="78" levelUpSp="17800000" />
		<skill skillName="Deadly Strike" skillId="1632" skillLevel="3" getLevel="78" levelUpSp="17800000" />
		<skill skillName="Power Break" skillId="115" skillLevel="19" getLevel="78" levelUpSp="17800000" />
		<skill skillName="Dance of Siren" skillId="365" skillLevel="1" getLevel="78" levelUpSp="17800000">
			<item id="90095" count="1" /> <!-- Scroll: Dance of Siren -->
		</skill>
		<skill skillName="Poison Blade Dance" skillId="84" skillLevel="4" getLevel="78" levelUpSp="17800000" />

		<skill skillName="Dance of Medusa" skillId="367" skillLevel="1" getLevel="79" levelUpSp="17800000">
			<item id="90096" count="1" /> <!-- Scroll: Dance of Medusa -->
		</skill>
		
		<skill skillName="Dual Weapon Mastery" skillId="144" skillLevel="41" getLevel="80" levelUpSp="17800000" />
		<skill skillName="Heavy Armor Mastery" skillId="232" skillLevel="56" getLevel="80" levelUpSp="17800000" />
		<skill skillName="Magic Resistance" skillId="147" skillLevel="55" getLevel="80" levelUpSp="17800000" />
		<skill skillName="Deadly Strike" skillId="1632" skillLevel="4" getLevel="80" levelUpSp="17800000" />
		<skill skillName="Dance of Berserker" skillId="915" skillLevel="1" getLevel="80" levelUpSp="17800000">
			<item id="90097" count="1" /> <!-- Scroll: Dance of Berserker -->
		</skill>
		
		<skill skillName="Dual Weapon Mastery" skillId="144" skillLevel="42" getLevel="81" levelUpSp="160000000" />
		<skill skillName="Heavy Armor Mastery" skillId="232" skillLevel="57" getLevel="81" levelUpSp="160000000" />
		<skill skillName="Magic Resistance" skillId="147" skillLevel="56" getLevel="81" levelUpSp="160000000" />
		<skill skillName="Deadly Strike" skillId="1632" skillLevel="5" getLevel="81" levelUpSp="160000000" />
		<skill skillName="Dance of Medusa" skillId="367" skillLevel="2" getLevel="81" levelUpSp="160000000" />
		<skill skillName="Dance of Shadows" skillId="366" skillLevel="2" getLevel="81" levelUpSp="160000000" />
		<skill skillName="Dance of Fury" skillId="275" skillLevel="2" getLevel="81" levelUpSp="160000000" />

		<skill skillName="Dual Weapon Mastery" skillId="144" skillLevel="43" getLevel="82" levelUpSp="170000000" />
		<skill skillName="Heavy Armor Mastery" skillId="232" skillLevel="58" getLevel="82" levelUpSp="170000000" />
		<skill skillName="Magic Resistance" skillId="147" skillLevel="57" getLevel="82" levelUpSp="170000000" />
		<skill skillName="Deadly Strike" skillId="1632" skillLevel="6" getLevel="82" levelUpSp="170000000" />
		<skill skillName="Dance of Concentration" skillId="276" skillLevel="2" getLevel="82" levelUpSp="170000000" />

		<skill skillName="Dual Weapon Mastery" skillId="144" skillLevel="44" getLevel="83" levelUpSp="240000000" />
		<skill skillName="Heavy Armor Mastery" skillId="232" skillLevel="59" getLevel="83" levelUpSp="240000000" />
		<skill skillName="Magic Resistance" skillId="147" skillLevel="58" getLevel="83" levelUpSp="240000000" />
		<skill skillName="Deadly Strike" skillId="1632" skillLevel="7" getLevel="83" levelUpSp="240000000" />
		<skill skillName="Dance of Medusa" skillId="367" skillLevel="3" getLevel="83" levelUpSp="240000000" />
		<skill skillName="Dance of Siren" skillId="365" skillLevel="2" getLevel="83" levelUpSp="240000000" />

		<skill skillName="Dual Weapon Mastery" skillId="144" skillLevel="45" getLevel="84" levelUpSp="240000000" />
		<skill skillName="Heavy Armor Mastery" skillId="232" skillLevel="60" getLevel="84" levelUpSp="240000000" />
		<skill skillName="Magic Resistance" skillId="147" skillLevel="59" getLevel="84" levelUpSp="240000000" />
		<skill skillName="Deadly Strike" skillId="1632" skillLevel="8" getLevel="84" levelUpSp="240000000" />
		<skill skillName="Dance of Shadows" skillId="366" skillLevel="3" getLevel="84" levelUpSp="240000000" />
		<skill skillName="Poison Blade Dance" skillId="84" skillLevel="5" getLevel="84" levelUpSp="240000000" />
		
		<skill skillName="Dual Weapon Mastery" skillId="144" skillLevel="46" getLevel="85" levelUpSp="840000000" />
		<skill skillName="Heavy Armor Mastery" skillId="232" skillLevel="61" getLevel="85" levelUpSp="840000000" />
		<skill skillName="Magic Resistance" skillId="147" skillLevel="60" getLevel="85" levelUpSp="840000000" />
	</skillTree>
</list>