<?xml version="1.0" encoding="UTF-8"?>
<list xmlns:xsi="http://www.w3.org/2001/XMLSchema-instance" xsi:noNamespaceSchemaLocation="../../../../xsd/skillTrees.xsd">
	<skillTree type="classSkillTree" classId="192">

		<skill skillName="Armor Mastery" skillId="464" skillLevel="1" getLevel="1" autoGet="true" />
		<skill skillName="Weapon Mastery" skillId="463" skillLevel="1" getLevel="1" autoGet="true" />
		<skill skillName="Kamael's Dignity" skillId="328" skillLevel="1" getLevel="1" autoGet="true" />
		<skill skillName="Expand Inventory" skillId="1372" skillLevel="1" getLevel="1">
			<item id="92004" count="1" /> <!-- Inventory Expansion Coupon Lv. 1 -->
		</skill>
		<skill skillName="Expand Inventory" skillId="1372" skillLevel="2" getLevel="1">
			<item id="92005" count="1" /> <!-- Inventory Expansion Coupon Lv. 2 -->
		</skill>
		<skill skillName="Expand Inventory" skillId="1372" skillLevel="3" getLevel="1">
			<item id="92006" count="1" /> <!-- Inventory Expansion Coupon Lv. 3 -->
		</skill>
		<skill skillName="Expand Inventory" skillId="1372" skillLevel="4" getLevel="1">
			<item id="92007" count="1" /> <!-- Inventory Expansion Coupon Lv. 4 -->
		</skill>
		<skill skillName="Expand Inventory" skillId="1372" skillLevel="5" getLevel="1">
			<item id="92008" count="1" /> <!-- Inventory Expansion Coupon Lv. 5 -->
		</skill>
		<skill skillName="Pride of Kamael" skillId="329" skillLevel="1" getLevel="1" autoGet="true" />

		<skill skillName="Soul Shield" skillId="45145" skillLevel="1" getLevel="2" levelUpSp="5" />

		<skill skillName="Soul Might" skillId="45144" skillLevel="1" getLevel="3" levelUpSp="5" />

		<skill skillName="Ability to Protect" skillId="91" skillLevel="1" getLevel="5" levelUpSp="15" />

		<skill skillName="Ability to Attack" skillId="77" skillLevel="1" getLevel="10" levelUpSp="100" />
		<skill skillName="Emergency Rescue" skillId="70" skillLevel="1" getLevel="10" levelUpSp="100" />

		<skill skillName="Death Mark" skillId="1435" skillLevel="1" getLevel="15" levelUpSp="500" />
		<skill skillName="Emergency Rescue" skillId="70" skillLevel="2" getLevel="15" levelUpSp="500" />
	</skillTree>
</list>