<?xml version="1.0" encoding="UTF-8"?>
<list xmlns:xsi="http://www.w3.org/2001/XMLSchema-instance" xsi:noNamespaceSchemaLocation="../../../../xsd/skillTrees.xsd">
	<skillTree type="classSkillTree" classId="32" parentClassId="31">
		<skill skillName="Sword/Blunt Weapon Mastery" skillId="217" skillLevel="1" getLevel="20" levelUpSp="1000" />
		<skill skillName="Heavy Armor Mastery" skillId="232" skillLevel="1" getLevel="20" levelUpSp="1000" />
		<skill skillName="Heavy Armor Mastery" skillId="232" skillLevel="2" getLevel="20" levelUpSp="1000" />
		<skill skillName="Heavy Armor Mastery" skillId="232" skillLevel="3" getLevel="20" levelUpSp="1000" />
		<skill skillName="Magic Resistance" skillId="147" skillLevel="1" getLevel="20" levelUpSp="1000" />
		<skill skillName="Magic Resistance" skillId="147" skillLevel="2" getLevel="20" levelUpSp="1000" />
		<skill skillName="Drain HP" skillId="70" skillLevel="3" getLevel="20" levelUpSp="1000" />
		<skill skillName="Drain HP" skillId="70" skillLevel="4" getLevel="20" levelUpSp="1000" />
		<skill skillName="Defense Aura" skillId="91" skillLevel="2" getLevel="20" levelUpSp="1000" />
		<skill skillName="Shield Mastery" skillId="153" skillLevel="1" getLevel="20" levelUpSp="1000" />
		<skill skillName="Ultimate Defense" skillId="110" skillLevel="1" getLevel="20" levelUpSp="1000" />
		<skill skillName="Poison" skillId="129" skillLevel="1" getLevel="20" levelUpSp="1000" />
		
		<skill skillName="Aggression" skillId="28" skillLevel="1" getLevel="22" levelUpSp="2800" />
		<skill skillName="Heavy Armor Mastery" skillId="232" skillLevel="4" getLevel="22" levelUpSp="2800" />
		<skill skillName="Sting" skillId="223" skillLevel="1" getLevel="22" levelUpSp="2800" />
		<skill skillName="Drain HP" skillId="70" skillLevel="5" getLevel="22" levelUpSp="2800" />
		<skill skillName="Magic Resistance" skillId="147" skillLevel="3" getLevel="22" levelUpSp="2800" />
		
		<skill skillName="Aggression" skillId="28" skillLevel="2" getLevel="23" levelUpSp="2800" />
		<skill skillName="Heavy Armor Mastery" skillId="232" skillLevel="5" getLevel="23" levelUpSp="2800" />
		<skill skillName="Sting" skillId="223" skillLevel="2" getLevel="23" levelUpSp="2800" />
		<skill skillName="Drain HP" skillId="70" skillLevel="6" getLevel="23" levelUpSp="2800" />
		<skill skillName="Magic Resistance" skillId="147" skillLevel="4" getLevel="23" levelUpSp="2800" />
		
		<skill skillName="Sword/Blunt Weapon Mastery" skillId="217" skillLevel="2" getLevel="24" levelUpSp="2800" />
		<skill skillName="Heavy Armor Mastery" skillId="232" skillLevel="6" getLevel="24" levelUpSp="2800" />
		<skill skillName="Magic Resistance" skillId="147" skillLevel="5" getLevel="24" levelUpSp="2800" />
		<skill skillName="Drain HP" skillId="70" skillLevel="7" getLevel="24" levelUpSp="2800" />
		<skill skillName="Aggression" skillId="28" skillLevel="3" getLevel="24" levelUpSp="2800" />
		<skill skillName="Sting" skillId="223" skillLevel="3" getLevel="24" levelUpSp="2800" />
		<skill skillName="Deflect Arrow" skillId="112" skillLevel="1" getLevel="24" levelUpSp="2800" />
		<skill skillName="Confusion" skillId="2" skillLevel="1" getLevel="24" levelUpSp="2800" />
		
		<skill skillName="Aggression" skillId="28" skillLevel="4" getLevel="26" levelUpSp="5700" />
		<skill skillName="Sword/Blunt Weapon Mastery" skillId="217" skillLevel="3" getLevel="26" levelUpSp="5700" />
		<skill skillName="Heavy Armor Mastery" skillId="232" skillLevel="7" getLevel="26" levelUpSp="5700" />
		<skill skillName="Sting" skillId="223" skillLevel="4" getLevel="26" levelUpSp="5700" />
		<skill skillName="Drain HP" skillId="70" skillLevel="8" getLevel="26" levelUpSp="5700" />
		<skill skillName="Magic Resistance" skillId="147" skillLevel="6" getLevel="26" levelUpSp="5700" />
		
		<skill skillName="Aggression" skillId="28" skillLevel="5" getLevel="27" levelUpSp="5700" />
		<skill skillName="Heavy Armor Mastery" skillId="232" skillLevel="8" getLevel="27" levelUpSp="5700" />
		<skill skillName="Sting" skillId="223" skillLevel="5" getLevel="27" levelUpSp="5700" />
		<skill skillName="Drain HP" skillId="70" skillLevel="9" getLevel="27" levelUpSp="5700" />
		<skill skillName="Magic Resistance" skillId="147" skillLevel="7" getLevel="27" levelUpSp="5700" />
		
		<skill skillName="Sword/Blunt Weapon Mastery" skillId="217" skillLevel="4" getLevel="28" levelUpSp="5700" />
		<skill skillName="Heavy Armor Mastery" skillId="232" skillLevel="9" getLevel="28" levelUpSp="5700" />
		<skill skillName="Magic Resistance" skillId="147" skillLevel="8" getLevel="28" levelUpSp="5700" />
		<skill skillName="Drain HP" skillId="70" skillLevel="10" getLevel="28" levelUpSp="5700" />
		<skill skillName="Aggression" skillId="28" skillLevel="6" getLevel="28" levelUpSp="5700" />
		<skill skillName="Sting" skillId="223" skillLevel="6" getLevel="28" levelUpSp="5700" />
		<skill skillName="Shield Mastery" skillId="153" skillLevel="2" getLevel="28" levelUpSp="5700" />
		<skill skillName="Confusion" skillId="2" skillLevel="2" getLevel="28" levelUpSp="5700" />
		<skill skillName="Attack Aura" skillId="77" skillLevel="2" getLevel="28" levelUpSp="5700" />
		
		<skill skillName="Aggression" skillId="28" skillLevel="7" getLevel="30" levelUpSp="11000" />
		<skill skillName="Sword/Blunt Weapon Mastery" skillId="217" skillLevel="5" getLevel="30" levelUpSp="11000" />
		<skill skillName="Heavy Armor Mastery" skillId="232" skillLevel="10" getLevel="30" levelUpSp="11000" />
		<skill skillName="Sting" skillId="223" skillLevel="7" getLevel="30" levelUpSp="11000" />
		<skill skillName="Drain HP" skillId="70" skillLevel="11" getLevel="30" levelUpSp="11000" />
		<skill skillName="Magic Resistance" skillId="147" skillLevel="9" getLevel="30" levelUpSp="11000" />
		
		<skill skillName="Aggression" skillId="28" skillLevel="8" getLevel="31" levelUpSp="11000" />
		<skill skillName="Heavy Armor Mastery" skillId="232" skillLevel="11" getLevel="31" levelUpSp="11000" />
		<skill skillName="Sting" skillId="223" skillLevel="8" getLevel="31" levelUpSp="11000" />
		<skill skillName="Drain HP" skillId="70" skillLevel="12" getLevel="31" levelUpSp="11000" />
		<skill skillName="Magic Resistance" skillId="147" skillLevel="10" getLevel="31" levelUpSp="11000" />
		
		<skill skillName="Sword/Blunt Weapon Mastery" skillId="217" skillLevel="6" getLevel="32" levelUpSp="11000" />
		<skill skillName="Heavy Armor Mastery" skillId="232" skillLevel="12" getLevel="32" levelUpSp="11000" />
		<skill skillName="Magic Resistance" skillId="147" skillLevel="11" getLevel="32" levelUpSp="11000" />
		<skill skillName="Drain HP" skillId="70" skillLevel="13" getLevel="32" levelUpSp="11000" />
		<skill skillName="Aggression" skillId="28" skillLevel="9" getLevel="32" levelUpSp="11000" />
		<skill skillName="Sting" skillId="223" skillLevel="9" getLevel="32" levelUpSp="11000" />
		<skill skillName="Deflect Arrow" skillId="112" skillLevel="2" getLevel="32" levelUpSp="11000" />
		<skill skillName="Confusion" skillId="2" skillLevel="3" getLevel="32" levelUpSp="11000" />
		<skill skillName="Power Break" skillId="115" skillLevel="1" getLevel="32" levelUpSp="11000">
			<item id="1382" count="1" />
		</skill>
		
		<skill skillName="Aggression" skillId="28" skillLevel="10" getLevel="34" levelUpSp="20000" />
		<skill skillName="Sword/Blunt Weapon Mastery" skillId="217" skillLevel="7" getLevel="34" levelUpSp="20000" />
		<skill skillName="Heavy Armor Mastery" skillId="232" skillLevel="13" getLevel="34" levelUpSp="20000" />
		<skill skillName="Sting" skillId="223" skillLevel="10" getLevel="34" levelUpSp="20000" />
		<skill skillName="Freezing Strike" skillId="105" skillLevel="1" getLevel="34" levelUpSp="20000">
			<item id="1381" count="1" />
		</skill>
		<skill skillName="Drain HP" skillId="70" skillLevel="14" getLevel="34" levelUpSp="20000" />
		<skill skillName="Magic Resistance" skillId="147" skillLevel="12" getLevel="34" levelUpSp="20000" />
		
		<skill skillName="Aggression" skillId="28" skillLevel="11" getLevel="35" levelUpSp="20000" />
		<skill skillName="Heavy Armor Mastery" skillId="232" skillLevel="14" getLevel="35" levelUpSp="20000" />
		<skill skillName="Sting" skillId="223" skillLevel="11" getLevel="35" levelUpSp="20000" />
		<skill skillName="Drain HP" skillId="70" skillLevel="15" getLevel="35" levelUpSp="20000" />
		<skill skillName="Magic Resistance" skillId="147" skillLevel="13" getLevel="35" levelUpSp="20000" />
		
		<skill skillName="Sword/Blunt Weapon Mastery" skillId="217" skillLevel="8" getLevel="36" levelUpSp="20000" />
		<skill skillName="Heavy Armor Mastery" skillId="232" skillLevel="15" getLevel="36" levelUpSp="20000" />
		<skill skillName="Magic Resistance" skillId="147" skillLevel="14" getLevel="36" levelUpSp="20000" />
		<skill skillName="Drain HP" skillId="70" skillLevel="16" getLevel="36" levelUpSp="20000" />
		<skill skillName="Aggression" skillId="28" skillLevel="12" getLevel="36" levelUpSp="20000" />
		<skill skillName="Sting" skillId="223" skillLevel="12" getLevel="36" levelUpSp="20000" />
		<skill skillName="Freezing Strike" skillId="105" skillLevel="2" getLevel="36" levelUpSp="20000" />
		<skill skillName="Focus Mind" skillId="191" skillLevel="1" getLevel="36" levelUpSp="20000" />
		<skill skillName="Confusion" skillId="2" skillLevel="4" getLevel="36" levelUpSp="20000" />
		<skill skillName="Power Break" skillId="115" skillLevel="2" getLevel="36" levelUpSp="20000" />
	</skillTree>
</list>